"","ShortAffil","id","lat","long","country"
"7982","stanford university school of medicine, stanford, california †aim lab, stanford university school of medicine, stanford, california",3987,37.4318102,-122.175758,"United States"
"7983","u.s. food and drug administration (retired), silver spring, md, usa",3988,38.9906657,-77.026088,"United States"
"7984","a school of kinesiology, acadia university, 550 main street, wolfville, ns b4p 2r6, canada",3989,45.0885733,-64.366817,"Canada"
"7986","b cardiovascular prevention and rehabilitation program, toronto rehabilitation institute/university health network, toronto, on, canada",3990,43.6566603,-79.3899178,"Canada"
"7988","northeast agriculture university, china",3991,45.73547,126.725765,"China"
"7989","hohai university, china",3992,32.054204,118.756843,"China"
"7990","kenya v. beard is associate vice president for curriculum and instruction and director of the center for multicultural education and health disparities at jersey college, teterboro, nj, and a member of the ajn editorial board",3993,NA,NA,NA
"7991","city university of new york, and a lecturer at rutgers university school of nursing, new brunswick, nj",3994,40.4942247,-74.4483942,"United States"
"7992","contact author: kenya v. beard, the authors have disclosed no potential conflicts of interest, financial or otherwise",3995,NA,NA,NA
"7993","research centre in physical activity and health, federal university of santa catarina, florianopolis, brazil",3996,-27.6005949,-48.5196415,"Brazil"
"7994","research centre in physical activity, health and leisure, faculty of sport, university of porto, porto, portugal",3997,41.1784647,-8.600203,"Portugal"
"7995","institute of physical education and sports, research centre in physical activity and health in school, federal university of ceara, fortaleza, brazil",3998,-3.7417415,-38.5386862,"Brazil"
"7999","federal university of ceara, fortaleza, brazil",3999,-3.7417415,-38.5386862,"Brazil"
"8001","aids project: education and prevention, federal university of ceara, fortaleza, brazil",4000,-3.7417415,-38.5386862,"Brazil"
"8006","faculty of education, federal university of ceara, fortaleza, brazil",4001,-3.7417415,-38.5386862,"Brazil"
"8012","fraser of allander neurosciences unit, royal hospital of sick children, glasgow, uk",4002,55.8624869,-4.340185,"United Kingdom"
"8014","royal hospital of sick children, glasgow, uk",4003,55.8624869,-4.340185,"United Kingdom"
"8015","bristol royal hospital for children, bristol, uk",4004,51.4578197,-2.597301,"United Kingdom"
"8016","world health organization collaborating centre for health promotion research, national university of ireland galway, galway, ireland",4005,53.2770243,-9.0614864,"Ireland"
"8018","school of applied human sciences, university of kwazulu-natal, durban, south africa",4006,-29.8674219,30.9807272,"South Africa"
"8019","hospital israelita albert einstein, albert einstein avenue, 627, são paulo, brazil",4007,-23.5999515,-46.7150129,"Brazil"
"8029","az delta, roeselare, belgium",4008,50.938006,3.1148909,"Belgium"
"8031","faculty of psychology and education, university of porto , porto , portugal",4009,41.1754278,-8.6045042,"Portugal"
"8033","michigan state university, east lansing, mi, united states",4010,42.701848,-84.4821719,"United States"
"8035","speech and hearing disorders, university medical center hamburg-eppendorf, hamburg, germany",4011,53.5941509,9.98943,"Germany"
"8036","institute for audiopedagogics, university of cologne, solingen, germany",4012,50.9281625,6.9288192,"Germany"
"8039","werner otto institut, hamburg, germany",4013,53.6150425,10.0265399,"Germany"
"8040","comprehensive school uellendahl-katernberg, wuppertal, germany",4014,51.27064,7.12326,"Germany"
"8043","temple university hospital, philadelphia, pennsylvania",4015,40.0052981,-75.1507565,"United States"
"8044","carolinas medical center, charlotte, north carolina",4016,35.2031423,-80.8387341,"United States"
"8045","university of maryland school of medicine, baltimore, maryland",4017,39.2889604,-76.625715,"United States"
"8047","baylor college of medicine, houston, texas",4018,29.710529,-95.396241,"United States"
"8049","conemaugh memorial medical center, johnstown, pennsylvania",4019,40.3052085,-78.9190006,"United States"
"8050","suny downstate medical center, brooklyn, new york",4020,40.6552459,-73.945734,"United States"
"8052","university of missouri-kansas city, kansas city, missouri",4021,39.0335539,-94.5760259,"United States"
"8053","health literacy and learning program, northwestern university, chicago, illinois, usa wolfson institute of preventive medicine, queen mary university of london, london, uk",4022,51.5224559,-0.0993185,"United Kingdom"
"8054","health literacy and learning program, northwestern university, chicago, illinois, usa",4023,41.896148,-87.6171094,"United States"
"8056","boston university school of medicine, boston, massachusetts, usa",4024,42.3361258,-71.0721348,"United States"
"8057","centre for cognitive ageing and cognitive epidemiology, the university of edinburgh, edinburgh, uk",4025,55.9445158,-3.1892413,"United Kingdom"
"8059","health literacy and learning program, northwestern university, chicago, illinois, northwestern university, evanston, illinois, usa",4026,42.0472068,-87.6758143,"United States"
"8061","center for global health engagement,uniformed services university,bethesda,maryland",4027,39.0018561,-77.0862793,"United States"
"8065","directorate of civil protection,republic of senegal,dakar,senegal",4028,14.716677,-17.4676861,"Senegal"
"8067","university of texas houston-memorial hermann, houston, tex",4029,29.7034179,-95.4030452,"United States"
"8068","laval university, québec, québec, canada centre de recherche de l'institut en santé mentale de québec, québec, canada",4030,46.8489235,-71.2203245,"Canada"
"8069","cobes-recherche et transfert, cégep de jonquière, saguenay, québec, canada",4031,48.405972,-71.24798,"Canada"
"8070","chaire visaj, département des sciences humaines, université du québec à chicoutimi, saguenay, québec, canada",4032,42.9821736,-81.2492589,"Canada"
"8071","cobes-recherche et transfert, cégep de jonquière, saguenay, québec, canada département des sciences de la santé, université du québec à chicoutimi, saguenay, québec, canada",4033,42.9821736,-81.2492589,"Canada"
"8072","a graduate programs in rehabilitation sciences, university of british columbia (ubc) , vancouver , british columbia , canada",4034,49.2606052,-123.2459938,"Canada"
"8073","b rehabilitation research program, gf strong rehabilitation centre , vancouver , british columbia , canada",4035,49.2474716,-123.1255961,"Canada"
"8074","c sunny hill health centre for children , therapy , vancouver , british columbia , canada",4036,49.2519743,-123.0482504,"Canada"
"8077","university of british columbia , vancouver , british columbia , canada",4037,49.2606052,-123.2459938,"Canada"
"8078","e holland bloorview kids rehabilitation hospital, bloorview research institute , toronto , ontario , canada",4038,43.7180569,-79.3741804,"Canada"
"8079","university of toronto , toronto , ontario , canada , and",4039,43.6628917,-79.3956564,"Canada"
"8080","university of toronto , toronto , ontario , canada",4040,43.6628917,-79.3956564,"Canada"
"8085","washington university in st. louis , st louis , mo , usa",4041,38.6487895,-90.3107962,"United States"
"8086","washburn university , topeka ks , usa",4042,39.0333113,-95.7017075,"United States"
"8089","university of illinois at chicago , chicago , il , usa",4043,41.8706448,-87.6509747,"United States"
"8090","doris cavlovich is a clinical education specialist at university of pittsburgh medical center in pittsburgh, pa",4044,NA,NA,NA
"8091","academic health center, indiana university health, indianapolis, in, usa",4045,39.7759976,-86.1769417,"United States"
"8092","mother baby unit academic health center, indiana university health, indianapolis, in, usa",4046,39.7774472,-86.1801283,"United States"
"8093","school of nursing, university of indianapolis, indianapolis, in, usa",4047,39.7761304,-86.1793027,"United States"
"8094","rush university medical center, chicago, il, usa va long beach healthcare system, ca, usa",4048,33.7787516,-118.1189138,"United States"
"8099","cancer center amsterdam (cca), vu university medical center, po box 7057, 1007 mb, amsterdam, the netherlands",4049,52.3358504,4.8589826,"Netherlands"
"8100","vu university medical center, po box 7057, 1007 mb, amsterdam, the netherlands",4050,52.3345709,4.8598158,"Netherlands"
"8101","emgo+ institute for health and care research, vrije universiteit amsterdam, van der boechorststraat 1, 1081 bt, amsterdam, the netherlands",4051,52.3337568,4.8657199,"Netherlands"
"8106","a school of public policy, intercampus doctoral program in gerontology , university of maryland , baltimore county, baltimore , maryland , usa",4052,39.2556129,-76.7109751,"United States"
"8109","hôpital du scorff, lorient, centre de simulation, france",4053,47.751719,-3.358155,"France"
"8110","centre de recherches en psychologie, cognition, communication, université de bretagne-sud, vannes, france",4054,47.658236,-2.760847,"France"
"8111","institut de formation des professionnels de la santé, lorient, france",4055,47.7421285,-3.3842273,"France"
"8112","fatemeh abdi is phd student, students research committee, shahid beheshti university of medical sciences, tehran, iran",4056,35.8001144,51.3980673,"Iran"
"8113","nasser ebrahimi daryani, md, is professor of gastroenterology, imam khomeini hospital, tehran university of medical sciences, tehran, iran",4057,35.7058552,51.3941057,"Iran"
"8114","farzin khorvash, md, is associate professor, nosocomial infection research center, isfahan university of medical sciences, isfahan, iran",4058,32.6128887,51.6616872,"Iran"
"8115","zahra yousefi, phd, is assistant professor, isfahan science and research branch, islamic azad university, isfahan, iran",4059,32.6431202,51.7823742,"Iran"
"8116","school of nursing, rutgers the state university of new jersey, newark (drs gray-miceli and de cordova",4060,NA,NA,NA
"8117","institute for health, health care policy and aging research, new brunswick, new jersey (dr gray-miceli",4061,40.4939427,-74.4487237,"United States"
"8118","visn 8 patient safety center of inquiry, james a",4062,40.7922763,-77.8628573,"United States"
"8119","haley hsr&d/rr&d center of innovation on disability and rehabilitation research visn, tampa, florida (dr quigley",4063,38.7501007,-90.7402785,"United States"
"8120","and center for clinical epidemiology and biostatistics, university of pennsylvania, philadelphia (dr ratcliffe). mr crane is a statistical consultant in princeton, new jersey",4064,40.0583238,-74.4056612,"United States"
"8121","loma linda university health , loma linda, california",4065,34.0498473,-117.2641184,"United States"
"8132","university of oxford, uk",4066,51.7548164,-1.2543668,"United Kingdom"
"8134","north bristol nhs trust, uk",4067,51.4982841,-2.5915971,"United Kingdom"
"8135","rotherham centralised product prescribing service, uk",4068,NA,NA,NA
"8137","jean spann anthony, phd, rn, is an associate professor at the university of cincinnati college of nursing",4069,39.1359919,-84.5083433,"United States"
"8138","her research focuses on mental health and health disparities and healthcare decision-making. edith morris, phd, ppcnp, is a research associate, cincinnati children's hospital medical center. her research interests include health disparities, adolescent health, and transcultural nursing",4070,42.3842841,-83.403497,"United States"
"8139","charles w. collins, md, mba, is a professor of psychiatry at the university of cincinnati college of medicine, director of clinical services, and chief clinical officer of psychiatry at the university of cincinnati medical center",4071,39.1385503,-84.5037427,"United States"
"8140","albert watson, phd, criminal justice and human service",4072,39.130103,-84.5187153,"United States"
"8141","his expertise includes training students in culturally competent counseling techniques, health disparities, and substance abuse",4073,40.1093272,-88.229911,"United States"
"8142","jennifer e. williams, edd, is a trauma-informed behavioral health clinician, trainer and advocate",4074,42.0163106,-92.9133604,"United States"
"8143","she is owner of j. w. williams & associates. b'nai ferguson, ma, is a social worker at the central community health board, cincinnati, ohio",4075,39.133757,-84.4984981,"United States"
"8144","deborah ruhlman, rn, aprn, works at st. elizabeth physicians, specializing in cardiology and women's health",4076,39.0030134,-84.4243445,"United States"
"8145","kathmandu medical college, kathmandu, nepal",4077,27.6967873,85.3525158,"Nepal"
"8146","faculty of medicine, epidemiology unit, prince of songkla university, thailand",4078,7.0069154,100.4965149,"Thailand"
"8147","pices (picowo), psychological institute for consultation, education, and scientific research, joseph haydnlaan 2a, 3533 ea, utrecht, the netherlands",4079,52.0869981,5.0851252,"Netherlands"
"8148","university of amsterdam, weesperplein 4, 1018 xa, amsterdam, the netherlands",4080,52.3637254,4.9127254,"Netherlands"
"8150","centro meta, p.o. box 17-21-622, quito, ecuador",4081,-0.2606214,-78.5494422,"Ecuador"
"8151","facultad de psicología, puce, pontificia universidad católica del ecuador, av",4082,-0.209239,-78.491436,"Ecuador"
"8152"," de octubre 1076 y roca, quito, ecuador",4083,-0.209239,-78.491436,"Ecuador"
"8158","universidad central del ecuador, ciudadela universitaria, av",4084,-0.2007709,-78.5020371,"Ecuador"
"8159","américa, quito, ecuador",4085,-0.1806532,-78.4678382,"Ecuador"
"8163","school of nursing, the university of texas at austin, austin, tx, usa",4086,30.2777456,-97.7335518,"United States"
"8168","evidence-based practice research centre, edge hill university, st helens road, ormskirk lancs, uk",4087,53.5596834,-2.8738498,"United Kingdom"
"8171","makerere university, po box 7062, kampala, uganda",4088,0.3279888,32.5674106,"Uganda"
"8172","imperial college hospital nhs trust, paddington, london, w2 1ny, uk",4089,51.5178113,-0.1742747,"United Kingdom"
"8173","gertner institute for epidemiology and health policy research,center for trauma and emergency medicine research,ramat gan,israel",4090,32.068424,34.824785,"Israel"
"8178","university of california , san francisco , ca , usa",4091,37.7859895,-122.4482377,"United States"
"8179","aurora health care, inc",4092,42.9936405,-87.9521662,"United States"
"8180"," milwaukee, wisconsin",4093,43.0389025,-87.9064736,"United States"
"8181","center for urban population health , milwaukee, wisconsin",4094,43.0437419,-87.926786,"United States"
"8182","university of wisconsin-milwaukee , milwaukee, wisconsin",4095,43.078263,-87.8819686,"United States"
"8188","urban studies program, university of wisconsin-milwaukee , milwaukee, wisconsin",4096,43.0768862,-87.8831631,"United States"
"8193","zilber school of public health, university of wisconsin-milwaukee , milwaukee, wisconsin",4097,43.0467316,-87.9242232,"United States"
"8194","university of wisconsin-madison , milwaukee, wisconsin",4098,43.076592,-89.4124875,"United States"
"8196","university of groningen, university medical center groningen, center for human movement sciences, antonius deusinglaan 1, groningen, 9713 av, the netherlands",4099,53.2218504,6.5760631,"Netherlands"
"8199","university of groningen, groningen institute for educational research, grote rozenstraat 3, groningen, 9712 tg, the netherlands",4100,53.2222332,6.5575978,"Netherlands"
"8200","university of groningen, faculty of behavioral and social sciences, grote rozenstraat 3, groningen, 9712 tg, the netherlands",4101,53.2222332,6.5575978,"Netherlands"
"8204","university of massachusetts boston , boston , ma , usa",4102,42.3148413,-71.0367377,"United States"
"8205","the university of memphis , memphis , tn , usa",4103,35.1224558,-89.9417973,"United States"
"8206","universidade federal do rio grande do norte, natal, rio grande do norte, brasil",4104,-5.8393707,-35.2007727,"Brazil"
"8207","universidade do estado do rio de janeiro, rio de janeiro, brasil",4105,-22.9111127,-43.2359131,"Brazil"
"8213","can misses hospital, ibiza, spain",4106,38.9159687,1.4188528,"Spain"
"8214","emgo institute for health and care research, vu university medical center, van der boechorststraat 7, 1081 bt amsterdam, the netherlands",4107,52.3335397,4.8629677,"Netherlands"
"8216","centers for disease control and prevention, epidemic intelligence service, atlanta, ga, usa",4108,33.7993178,-84.328008,"United States"
"8217","columbus, oh, usa",4109,39.9611755,-82.9987942,"United States"
"8221","centers for disease control and prevention, waterborne, and environmental diseases, atlanta, ga, usa",4110,33.7993178,-84.328008,"United States"
"8222","summit county public health, akron, oh, usa",4111,41.1142736,-81.5741941,"United States"
"8223","cuyahoga county board of health, parma, oh, usa",4112,41.4113408,-81.7809806,"United States"
"8230","institut d'investigacions biomèdiques august pi i sunyer (idibaps), 08036 barcelona, spain",4113,41.388589,2.150886,"Spain"
"8231","event lab, faculty of psychology, university of barcelona, 08035 barcelona, spain",4114,41.386608,2.16402,"Spain"
"8234","institució catalana de recerca i estudis avançats (icrea), 08010 barcelona, spain",4115,41.3911775,2.1795176,"Spain"
"8235","university of barcelona, 08035 barcelona, spain",4116,41.386608,2.16402,"Spain"
"8236","faculty of dentistry, institute of clinical dentistry, university of oslo, norway",4117,59.9334947,10.7432575,"Norway"
"8237","faculty of education, university of oslo, oslo, norway",4118,59.9399586,10.7217496,"Norway"
"8239","stfold university college, fredrikstad, norway",4119,59.2126742,10.9307943,"Norway"
"8240","discipline of medical imaging, curtin university, gpo box u1987, perth, western australia, 6845, australia",4120,-27.6728168,121.6283098,"Australia"
"8241","college of earth and environmental sciences, university of the punjab, lahore 54590, pakistan",4121,31.4968187,74.2949742,"Pakistan"
"8245","college of petroleum and geosciences, king fahd university of petroleum & minerals, dhahran 31261, saudi arabia",4122,26.3054776,50.1481495,"Saudi Arabia"
"8246","institute of chemistry, university of the punjab, lahore 54590, pakistan",4123,31.5012241,74.306466,"Pakistan"
"8247","institute of geology, university of the punjab, lahore 54590, pakistan",4124,31.4789841,74.2661627,"Pakistan"
"8249","nanjing maternity and child health care hospital affiliated with nanjing medical university, nanjing, china",4125,32.060255,118.796877,"China"
"8252","institute of pediatrics, nanjing medical university, nanjing, china",4126,32.043846,118.774763,"China"
"8254","dachang community health service centers, liuhe district, nanjing, jiangsu, china",4127,32.2168533,118.750456,"China"
"8261","faculty of veterinary and agricultural sciences, the university of melbourne, parkville, victoria 3010, australia",4128,-37.7975879,144.9531748,"Australia"
"8264","vets beyond borders, the rocks, sydney, nsw 2000, australia",4129,-33.8593994,151.2073536,"Australia"
"8267","livestock, fisheries and veterinary services, government of sikkim, sikkim, india",4130,27.3198924,88.6066031,"India"
"8269","asia-pacific centre for animal health, faculty of veterinary and agricultural sciences, the university of melbourne, parkville, victoria 3010, australia",4131,-37.7962849,144.9598069,"Australia"
"8271","rutgers-robert wood johnson medical school, new brunswick, new jersey, usa",4132,40.5245979,-74.468455,"United States"
"8274","rutgers-robert wood johnson medical school, new brunswick, new jersey, usa nj retina, new brunswick, new jersey, usa",4133,40.5245979,-74.468455,"United States"
"8277","professor of medicine, university of california san francisco",4134,37.7623117,-122.4576994,"United States"
"8278","colleges of nursing (drs nichols, nemeth, magwood, and newman) and medicine (dr odulana), medical university of south carolina, charleston",4135,32.7844632,-79.946747,"United States"
"8280","sc college of pharmacy, university of south carolina , columbia , south carolina , usa",4136,33.9958594,-81.0295629,"United States"
"8281","palmetto health richland , columbia , south carolina , usa",4137,34.0274265,-81.0326741,"United States"
"8283","university of mississippi , jackson , mississippi , usa",4138,32.3304534,-90.1721426,"United States"
"8284","d triad isotopes, richmond , virginia , usa",4139,39.061052,-76.88894,"United States"
"8285","e sc college of pharmacy, university of south carolina , columbia , south carolina , usa",4140,33.9958594,-81.0295629,"United States"
"8286","f college of nursing, university of south carolina , columbia , south carolina , usa",4141,33.9980964,-81.0244018,"United States"
"8287","a school of nursing and health studies , university of washington bothell , bothell , washington",4142,47.7589,-122.1906495,"United States"
"8288","b school of interdisciplinary arts and sciences , university of washington bothell , bothell , washington",4143,47.7589,-122.1906495,"United States"
"8289","perelman school of medicine at the university of pennsylvania, 4 maloney building, 3400 spruce street, philadelphia, pa 19104, usa",4144,39.9476279,-75.192598,"United States"
"8290","general surgery residency program, perelman school of medicine at the university of pennsylvania, 4 maloney building, 3400 spruce street, philadelphia, pa 19104, usa",4145,39.9476279,-75.192598,"United States"
"8291","general surgery residency program, perelman school of medicine at the university of pennsylvania, 4 silverstein building 3400 spruce street, philadelphia, pa 19104, usa",4146,39.9476279,-75.192598,"United States"
"8292","jennifer rheingans, phd, rn-bc, ahn-bc, nursing professional development - research specialist, sarasota memorial healthcare system, sarasota, fl",4147,27.3180001,-82.5312815,"United States"
"8293","federal university of juiz de fora",4148,-21.7769499,-43.3689823,"Brazil"
"8294","federal university of minas gerais",4149,-19.8690878,-43.9663841,"Brazil"
"8295","rotterdam university of applied sciences, the netherlands",4150,51.9102451,4.4627881,"Netherlands"
"8296","erasmus university rotterdam, the netherlands",4151,51.91752,4.525585,"Netherlands"
"8297","ghent university, belgium",4152,51.0465619,3.7279181,"Belgium"
"8298","buurtzorg nederland, the netherlands",4153,52.3306862,6.6507481,"Netherlands"
"8299","erasmus university rotterdam, institute of health policy and management, the netherlands",4154,51.916241,4.523191,"Netherlands"
"8302","riverside methodist hospital, united states",4155,40.0308026,-83.0345056,"United States"
"8303","ohiohealth research institute, united states",4156,37.09024,-95.712891,"United States"
"8304","section of hematology and oncology, the ohio state university, united states",4157,41.7882602,-87.6045592,"United States"
"8305","section of hematology and oncology, university of mississippi, united states",4158,41.7882602,-87.6045592,"United States"
"8306","central ohio primary care physicians, united states",4159,40.0310368,-83.0343464,"United States"
"8309","harvard school of public health, 665 huntington ave, boston, ma, 02215, usa",4160,42.3354484,-71.1027166,"United States"
"8312","faculty of medicine, center for life sciences, pontifical catholic university of campinas (puc-campinas), campinas, são paulo, brazil",4161,-23.5505199,-46.6333094,"Brazil"
"8313","ball state university, muncie, indiana, usa",4162,40.2061028,-85.406986,"United States"
"8314","university of south carolina, columbia, south carolina, usa",4163,33.996112,-81.0274276,"United States"
"8318","national institute of public health, mexico city, mexico",4164,19.4326077,-99.133208,"Mexico"
"8320","guttmacher institute",4165,NA,NA,NA
"8322","association béninoise pour le marketing social et la communication pour la sant",4166,NA,NA,NA
"8324","arizona state university, phoenix, az, usa",4167,33.452957,-112.0734511,"United States"
"8325","montana state university, bozeman, mt, usa",4168,45.6667557,-111.04981,"United States"
"8326","the university of montana, missoula, mt, usa",4169,46.8600672,-113.9852081,"United States"
"8327","whitson-hester school of nursing, tennessee technological university, cookeville, tennessee (dr tzeng",4170,36.175903,-85.5070223,"United States"
"8328","college of nursing, washington state university, spokane (ms graham",4171,47.6605016,-117.4082467,"United States"
"8329","chinese culture university, taipei, taiwan (mr yin",4172,NA,NA,NA
"8330","and kootenai health, coeur d'alene, idaho (ms fitzgerald",4173,47.6955773,-116.7932108,"United States"
"8331","school of rural health, monash university, traralgon, victoria, australia",4174,-37.9105238,145.1362182,"Australia"
"8332","surgery, bendigo health, bendigo, victoria, australia",4175,-36.749617,144.280769,"Australia"
"8334","cincinnati children's hospital medical center , cincinnati, oh",4176,39.1410708,-84.5013487,"United States"
"8335","school of human services, college of education, criminal justice, and human services, university of cincinnati , cincinnati, oh",4177,39.130103,-84.5187153,"United States"
"8338","health and social care institute, teesside university, middlesbrough, uk",4178,54.5707555,-1.235222,"United Kingdom"
"8339","pain clinic, james cook university hospital, south tees nhs hospitals trust, middlesbrough, uk",4179,54.5512103,-1.2148044,"United Kingdom"
"8343","memorial university of newfoundland, st. john's, nl, canada",4180,47.5737975,-52.7329053,"Canada"
"8344","woking and sam beare hospices, woking, uk",4181,51.3185746,-0.5925109,"United Kingdom"
"8345","prospect hospice, swindon, uk",4182,51.5264768,-1.7850049,"United Kingdom"
"8346","author affiliation: assistant professor, school of nursing, university of massachusetts lowell",4183,42.6500568,-71.3240468,"United States"
