"","ShortAffil","id","lat","long","country"
"5716","the university of queensland, brisbane, qld, australia",2795,-27.4954306,153.0120301,"Australia"
"5719","massachusetts institute of technology , cambridge, massachusetts",2796,42.360091,-71.09416,"United States"
"5720","nottingham",2797,52.9547832,-1.1581086,"United Kingdom"
"5721","clinical research unit, hospital sant antoni abat, fundació privada sant antoni abat, c/ sant josep 21-23, vilanova i la geltrú, 08800, barcelona, spain",2798,41.2288373,1.7219495,"Spain"
"5722","consorci sanitari del garraf, vilanova i la geltrú, 08800, barcelona, spain",2799,41.2236504,1.7350543,"Spain"
"5729","the children's hospital of philadelphia, philadelphia, pennsylvania",2800,39.9488993,-75.1938646,"United States"
"5730","centro internacional de neurodesenvolvimento neonatal, são paulo, sp, brazil",2801,-23.5505199,-46.6333094,"Brazil"
"5731","jean shinners, phd, rn-bc, is executive director, center for the advancement of nursing, versant, hobe sound, florida",2802,26.3730585,-80.120319,"United States"
"5732","larissa africa, bsn, mba, rn, is president, versant rn residencies, versant, st. petersburg, florida",2803,27.922422,-82.3005641,"United States"
"5733","beth hawkes, msn, rn-bc, is nursing professional staff development specialist, san joaquin community hospital, bakersfield, california",2804,35.3835726,-119.0201638,"United States"
"5734","université libre de bruxelles, brussels, belgium",2805,50.8132068,4.3822222,"Belgium"
"5735","chu brugmann, université libre de bruxelles, brussels, belgium",2806,50.8874371,4.3314905,"Belgium"
"5736","epidemiology and health economics, university of liège, liège, belgium",2807,50.5830803,5.559064,"Belgium"
"5738","metabolic bone unit, university of florence, florence, italy",2808,43.7776426,11.259765,"Italy"
"5739","mrc lifecourse epidemiology unit, university of southampton, southampton, uk",2809,50.932818,-1.4375336,"United Kingdom"
"5740","university of oxford, oxford, uk",2810,51.7548164,-1.2543668,"United Kingdom"
"5741","saint luc university hospital, université catholique de louvain, louvain-la-neuve, belgium",2811,50.6696875,4.6155909,"Belgium"
"5742","gerontology and geriatrics section, katholiek universiteit leuven, leuven, belgium",2812,50.8779545,4.7002953,"Belgium"
"5743","state university of ghent, ghent, belgium",2813,51.0465619,3.7279181,"Belgium"
"5745","geneva university hospitals and faculty of medicine, geneva, switzerland",2814,46.193597,6.1490199,"Switzerland"
"5747","aalborg, denmark",2815,57.0488195,9.921747,"Denmark"
"5748","danish center for healthcare improvements, aalborg university, aalborg, denmark",2816,57.0145665,9.9818527,"Denmark"
"5750","university of tromsø, tromsø, norway",2817,69.679788,18.9710079,"Norway"
"5752","university of massachusetts, 110 totman building, 30 eastman lane, amherst, ma 01003-9258",2818,42.3960755,-72.5258414,"United States"
"5756","university of massachusetts, 149 goessmann building, amherst, ma 01003-9258",2819,NA,NA,NA
"5757","michigan state university, 30 w",2820,42.701848,-84.4821719,"United States"
"5758","circle drive, east lansing, mi 48824",2821,42.731821,-84.4834202,"United States"
"5759","gramercy research group, 7990 n",2822,36.1509875,-80.2730054,"United States"
"5760","point blvd, suite 108, winston-salem, nc 27106",2823,36.0998596,-80.244216,"United States"
"5761","a continuing education centre , universiti brunei darussalam , jl",2824,4.972665,114.89397,"Brunei"
"5762","tungku link gadong, negara brunei darussalam",2825,4.972665,114.89397,"Brunei"
"5763","northshore lij staten island university hospital, staten island, ny, united states of america",2826,40.584781,-74.0860891,"United States"
"5764","lerner research institute, cleveland clinic, cleveland, oh, united states of america",2827,41.500283,-81.619287,"United States"
"5765","massachusetts general hospital, boston, ma, united states of america",2828,42.3631671,-71.0687306,"United States"
"5766","faculty of medicine, american university of beirut, beirut, lebanon",2829,33.9008359,35.480744,"Lebanon"
"5767","neurological surgery, and psychiatry (dr kreutzer), dr godwin), virginia commonwealth university, richmond, virginia",2830,37.5488396,-77.4527272,"United States"
"5769","pediatric residency program, medical college of wisconsin, milwaukee, wi, usa",2831,43.0435866,-88.0211208,"United States"
"5771","office of academic affairs, medical college of wisconsin, milwaukee, wi, usa",2832,43.0435866,-88.0211208,"United States"
"5772","monitoring, mamta health institute for mother & child, b-5, greater kailash enclave-ii, new delhi, 110048, india",2833,28.54786,77.2376414,"India"
"5781","author affiliations: clinical nurse iii (ms anthony) and research facilitator (dr wickman), st jude medical center, fullerton",2834,33.8941479,-117.9278813,"United States"
"5782","and director (dr wickman), vanguard university, costa mesa, california",2835,33.6618632,-117.9016912,"United States"
"5783","university of connecticut health center, farmington, connecticut",2836,41.7307425,-72.7904775,"United States"
"5787","senior lecturer and course director for non-medical prescribing and bsc in professional practice, coventry university",2837,52.4071747,-1.5037461,"United Kingdom"
"5789","national institute of mental health and neurosciences (nimhans), bangalore, 560029, india",2838,12.9406819,77.5982643,"India"
"5797","north east medical services, san francisco, ca, usa",2839,37.7290214,-122.404483,"United States"
"5798","university of minnesota in minneapolis, mn, usa",2840,44.97399,-93.2277285,"United States"
"5802","university of newcastle, tamworth, new south wales, australia",2841,-31.0741798,150.9197367,"Australia"
"5803","university of wollongong, wollongong, new south wales, australia",2842,-34.4054039,150.87843,"Australia"
"5806","neuroscience institute, the queen's medical center, honolulu, hi (mmi, mav, kn",2843,21.3078718,-157.8548819,"United States"
"5810","swiss tropical and public health institute, socinstrasse 57, basel, switzerland",2844,47.556104,7.577261,"Switzerland"
"5811","university of basel, petersplatz 1, basel, switzerland",2845,47.5602535,7.5826,"Switzerland"
"5812","istituto di elettronica e di ingegneria dell'informazione e delle telecomunicazioni (ieiit), consiglio nazionale delle ricerche (cnr), milano, italy",2846,45.4642035,9.189982,"Italy"
"5813","dipartimento di elettronica, informazione e bioingegneria (deib), politecnico di milano, milano, italy",2847,45.4786698,9.2324209,"Italy"
"5816","cyprus international institute for environmental and public health in association with harvard th chan school of public health, cyprus university of technology, irenes 95, limassol, cyprus",2848,34.7316496,33.1622529,"Cyprus"
"5820","school of economics, university of cape town, southern africa labour and development research unit, school of economics, university of cape town, cape town, south africa",2849,-33.9550776,18.4652802,"South Africa"
"5822","southern africa labour and development research unit, school of economics, university of cape town, cape town, south africa",2850,-33.9550776,18.4652802,"South Africa"
"5823","oakland university william beaumont school of medicine, 2200 n",2851,42.6744905,-83.2152964,"United States"
"5824","squirrel rd., o'dowd hall 131, rochester hill, michigan 48309 usa",2852,42.6744797,-83.2155496,"United States"
"5826","netherlands organization for applied scientific research tno, p.o. box 3005, nl-2301 da, leiden, the netherlands",2853,52.1601144,4.4970097,"Netherlands"
"5827"," research center on physical activity, work and health, tno-vu/vumc, amsterdam, the netherlands",2854,52.3345709,4.8598158,"Netherlands"
"5828","the emgo+ institute for health and care research, vu university medical center, p.o. box 7057, nl-1007 mb, amsterdam, the netherlands",2855,52.3335397,4.8629677,"Netherlands"
"5833","veiligheidnl, overschiestraat 65, nl-1062 xd, amsterdam, the netherlands",2856,52.3439692,4.8397431,"Netherlands"
"5837","health and technology, university of twente, p",2857,52.2393971,6.8508709,"Netherlands"
"5838","o. box 217, 7500 ae, enschede, the netherlands",2858,52.2393971,6.8508709,"Netherlands"
"5841","university of utah hospital, salt lake city, utah",2859,40.771573,-111.8366748,"United States"
"5848","a faculty of education , the university of hong kong",2860,22.2840615,114.1378987,"Hong Kong"
"5850","austin hospital, melbourne, vic",2861,-37.7564117,145.0602786,"Australia"
"5852","central clinic central clinic, alice springs, nt",2862,-23.7013358,133.8816295,"Australia"
"5853","group research and development, british american tobacco (investments) ltd, southampton, united kingdom",2863,50.9166103,-1.4382808,"United Kingdom"
"5857","john ware research group, worcester, ma",2864,42.2770575,-71.7664446,"United States"
"5859","umass medical school, worcester, ma",2865,42.2772479,-71.7610714,"United States"
"5863","author affiliations: school of nursing (drs mann, medves, queen's university, kingston, ontario, canada",2866,44.2311717,-76.4859544,"Canada"
"5864","university of minnesota, school of public health, minneapolis, mn, usa",2867,44.9721714,-93.2331609,"United States"
"5865","university of north carolina, gillings school of global public health, chapel hill, nc, usa",2868,35.9057803,-79.0540572,"United States"
"5866","university of minnesota, medical school, minneapolis, mn, usa",2869,44.972274,-93.2328688,"United States"
"5871","suny upstate medical university, syracuse, ny, usa",2870,43.0402889,-76.1390412,"United States"
"5872","center for underrepresented minorities in academic medicine, college of medicine, florida state university, tallahassee, fl, usa",2871,30.4455474,-84.3055844,"United States"
"5874","college of medicine, suny upstate medical university, syracuse, ny, usa",2872,43.0402889,-76.1390412,"United States"
"5875","lerner center for public health promotion, maxwell school of citizenship & public affairs, syracuse university, syracuse, ny, usa",2873,43.0379769,-76.1355729,"United States"
"5876","robert graham center, washington, dc, usa",2874,38.904972,-77.0401428,"United States"
"5877","university of cincinnati, cincinnati, oh, usa",2875,39.1329219,-84.5149504,"United States"
"5878","georgetown university, washington, dc, usa",2876,38.9076089,-77.0722585,"United States"
"5879","virginia commonwealth university, virginia, usa",2877,37.5488396,-77.4527272,"United States"
"5880","george washington university school of public health, washington, dc, usa",2878,38.9020965,-77.051046,"United States"
"5885","orthopaedic surgery resident, warren alpert medical school of brown university",2879,41.8188215,-71.4087208,"United States"
"5886","orthopaedic surgery resident, warren alpert medical school of brown university, providence, rhode island",2880,41.8188215,-71.4087208,"United States"
"5887","emergency medicine resident, warren alpert medical school of brown university, providence, rhode island",2881,41.8188215,-71.4087208,"United States"
"5888","residency program director, warren alpert medical school of brown university, providence, rhode island",2882,41.8188215,-71.4087208,"United States"
"5890","korea university college of medicine, seoul, korea",2883,37.590799,127.0277773,"South Korea"
"5900","kentish regional clinic inc, sheffield, tasmania, australia",2884,-41.380868,146.3263701,"Australia"
"5902","school of medicine, university of tasmania, hobart, tasmania, australia",2885,-42.8787432,147.3297053,"Australia"
"5904","school of health sciences, university of tasmania, launceston, tasmania, australia",2886,-41.4024812,147.1217607,"Australia"
"5906","university of washington, seattle, washington, usa",2887,47.6553351,-122.3035199,"United States"
"5910","brigham and women's hospital/harvard medical school, boston, ma, usa",2888,42.3359248,-71.1066945,"United States"
"5911","dana-farber cancer institute, boston, ma, usa",2889,42.3376481,-71.1081199,"United States"
"5914","brigham and women's hospital, boston, ma, usa",2890,42.3360139,-71.1069841,"United States"
"5918","university of texas health science center at san antonio, san antonio, texas",2891,29.5074654,-98.5753521,"United States"
"5921","faculty of clinical sciences, college of health sciences, obafemi awolowo university, ile-ife, osun state, nigeria",2892,7.516646,4.525976,"Nigeria"
"5922","neurology unit, obafemi awolowo university teaching hospitals complex, ile-ife, osun state, nigeria",2893,7.490462,4.5521274,"Nigeria"
"5923","faculty of basic medical sciences, college of health sciences, obafemi awolowo university, ile-ife, osun state, nigeria",2894,7.516646,4.525976,"Nigeria"
"5934","norwegian university of science and technology, norway",2895,63.419499,10.4020771,"Norway"
"5935","regional centre for child and youth mental health and child welfare, central norway, norway national competence centre for complex symptom disorders",2896,NA,NA,NA
"5936","st olav's university hospital, norway",2897,63.421038,10.388039,"Norway"
"5937","norwegian university of science and technology, norway norwegian advisory unit on headaches, st olav's university hospital, norway",2898,63.421038,10.388039,"Norway"
"5938","programa de educação tutorial, faculdade de medicina de ribeirão preto, universidade de são paulo, ribeirão preto, sp, brasil",2899,-21.1637734,-47.8529983,"Brazil"
"5942","programa de educação tutorial, escola de enfermagem de ribeirão preto, universidade de são paulo, ribeirão preto, sp, brasil",2900,-21.1635483,-47.8487459,"Brazil"
"5949","national institute of health and nutrition, 1-23-1 toyama, shinjuku-ku, tokyo, 162-8636, japan",2901,36.204824,138.252924,"Japan"
"5950","brigham & women's hospital, harvard medical school, 900 commonwealth ave east, boston, ma, 02215, usa",2902,42.3360139,-71.1069841,"United States"
"5951","physical education and medicine research center unnan, 1212-3 mitoya, mitoya-cho, unnan, shimane, 690-2404, japan",2903,36.204824,138.252924,"Japan"
"5954","graduate school of medicine, yokohama city university, 3-9 fukuura, kanazawa-ku, yokohama, kanagawa, 236-0004, japan",2904,14.4762005,121.0275033,"Philippines"
"5955","tokyo medical university, 6-1-1, shinjuku, shinjuku-ku, tokyo, 160-8402, japan",2905,35.693451,139.712321,"Japan"
"5956","school of public health, the university of tokyo, 7-3-1 hongo, bunkyo-ku, tokyo, 113-0033, japan",2906,35.7126775,139.761989,"Japan"
"5957","national centre for geriatrics and gerontology, 7-430 morioka-machi, obu, aichi, 474-8511, japan",2907,36.204824,138.252924,"Japan"
"5959","harvard school of public health, 677 huntington avenue, boston, ma, 02115, usa",2908,42.3354484,-71.1027166,"United States"
"5960","school of public health, the university of sydney, sydney, nsw, 2006, australia",2909,-33.888226,151.188702,"Australia"
"5962","gwang ha kim, pusan national university school of medicine and biomedical research institute, pusan national university hospital, busan 602-739, south korea",2910,35.907757,127.766922,"South Korea"
"5965","college of pharmacy, university of minnesota, duluth, mn",2911,44.9733754,-93.2310087,"United States"
"5966","park nicollet methodist hospital, st. louis park, mn",2912,44.9291213,-93.3619571,"United States"
"5969","research group 'social issues & health', leipzig university of applied sciences (htwk leipzig), leipzig, germany",2913,51.3396955,12.3730747,"Germany"
"5970","institute for public health and nursing research, university of bremen, bremen, germany",2914,53.106758,8.85204,"Germany"
"5973","rasoul-e-akram hospital, iran university of medical sciences, tehran, iran",2915,35.7489889,51.3805624,"Iran"
"5974","and students' scientific research center (ssrc), exceptional talent development center (etdc), tehran university of medical sciences, tehran, iran",2916,35.7070613,51.3976264,"Iran"
"5975","students' scientific research center (ssrc), exceptional talent development center (etdc), tehran university of medical sciences, tehran, iran",2917,35.7070613,51.3976264,"Iran"
"5977","and non-communicable diseases research center, endocrinology and metabolism population sciences institute, tehran university of medical sciences, tehran, iran",2918,35.7058552,51.3941057,"Iran"
"5978","university of adelaide, adelaide, australia",2919,-34.920603,138.6062277,"Australia"
"5979","yerevan state medical university, armenia",2920,40.1876978,44.5257514,"Armenia"
"5981","university of california, los angeles, los angeles, california",2921,34.068921,-118.4451811,"United States"
"5985","ministry of health and family welfare (moh&fw), bangladesh",2922,23.684994,90.356331,"Bangladesh"
"5986","children without worms, the task force for global health, atlanta, ga, usa",2923,33.7489954,-84.3879824,"United States"
"5987","center for global health, centers for disease control and prevention, atlanta, ga, usa",2924,33.7993178,-84.328008,"United States"
"5994","university of eastern finland, faculty of health sciences, kuopio campus, p.o.b 1627, 70211 kuopio, finland",2925,62.8974658,27.647018,"Finland"
"5996","kuopio university hospital, development, clinical education and research unit of nursing, p.o.b 100, 70029 kys, finland",2926,62.8974658,27.647018,"Finland"
"5997","university of eastern finland, kuopio campus, language centre, p.o.b 1627, 70211 kuopio, finland",2927,62.8974658,27.647018,"Finland"
"5998","emory university, atlanta, ga, usa",2928,33.7925195,-84.3239989,"United States"
"6003","university of georgia, atlanta, ga, usa",2929,33.753068,-84.3852819,"United States"
"6004","albany state university, albany, ga, usa",2930,31.5690317,-84.1404238,"United States"
"6005","albany, ga, usa",2931,31.5785074,-84.155741,"United States"
"6009","columbia university medical center, new york state psychiatric institute, new york, ny, usa",2932,40.8410971,-73.9411973,"United States"
"6010","gillings school of global public health, the university of north carolina at chapel hill, chapel hill, nc, usa",2933,35.9057803,-79.0540572,"United States"
"6011","lineberger comprehensive cancer center, school of medicine, university of north carolina at chapel hill, chapel hill, nc, usa",2934,35.9030823,-79.0535748,"United States"
"6012","schroeder institute for tobacco research and policy studies at truth initiative, washington, dc, usa",2935,38.9071923,-77.0368707,"United States"
"6013","health media collaboratory, institute for health research and policy, university of illinois at chicago, chicago, il, usa",2936,41.8663893,-87.6706475,"United States"
"6025","cluj-napoca county university emergency hospital, radiology desk, ""iuliu hatieganu"" university of medicine and pharmacy, cluj-napoca, romania",2937,46.7712101,23.6236353,"Romania"
"6026","positivo university, curitiba, paraná, brazil",2938,-25.4464138,-49.3588235,"Brazil"
"6027","jacques perissat institute, curitiba, paraná, brazil",2939,-25.443148,-49.3384137,"Brazil"
"6028","universidade federal do rio grande do sul, rio grande do sul, brazil",2940,-30.0338248,-51.218828,"Brazil"
"6032","positivo university, curitiba, paraná, brazil jacques perissat institute, curitiba, paraná, brazil",2941,-25.443148,-49.3384137,"Brazil"
"6033","university of cyprus, nicosia, cyprus",2942,35.1600014,33.3770175,"Cyprus"
"6034","faculty of medicine, dentistry and health sciences, university of melbourne, parkville, victoria, australia",2943,-37.7994303,144.9589064,"Australia"
"6035","royal melbourne hospital, parkville, victoria, australia",2944,-37.7990618,144.9559889,"Australia"
"6036","assistant professor of health management and policy at the georgia state university school of public health in atlanta",2945,33.753068,-84.3852819,"United States"
"6037","senior investigator at the kaiser permanente center for health research in portland, or",2946,45.550198,-122.6804997,"United States"
"6038","honolulu",2947,21.3069444,-157.8583333,"United States"
"6039","research and data analytics center manager and technical research program manager at the kaiser permanente center for health research in portland, or",2948,45.550198,-122.6804997,"United States"
"6040","research program manager at the kaiser permanente center for health research in portland, or",2949,45.550198,-122.6804997,"United States"
"6041","faculty scientist in the center for outcomes research and evaluation at the maine medical center research institute in scarborough",2950,43.6045558,-70.3142946,"United States"
"6043","royal college of nursing, london, and a florence nightingale scholar",2951,51.4969523,-0.1466259,"United Kingdom"
"6044","jae hyun kim, seun ja park, kosin university college of medicine, busan 602-702, south korea",2952,35.907757,127.766922,"South Korea"
"6053","paracelsus medical university, nuremberg, germany",2953,49.4641774,11.0577466,"Germany"
"6054","university hospital, münster, germany",2954,51.95963,7.59697,"Germany"
"6060","author affiliations: college of nursing, university of wisconsin-milwaukee (dr choi",2955,33.0140479,-96.7916993,"United States"
"6061","and vets' club program, clement j. zablocki va medical center, milwaukee, wi",2956,43.0204769,-87.9747193,"United States"
"6063","university of reading,uk",2957,51.4414205,-0.9418157,"United Kingdom"
"6064","university college london,uk",2958,51.5245592,-0.1340401,"United Kingdom"
"6065","berkshire healthcare nhs foundation trust,reading,uk",2959,51.4468653,-0.9985014,"United Kingdom"
"6067","clinical psychology program, texas tech university and clinical child psychology program, university of kansas",2960,38.9543439,-95.2557961,"United States"
"6071","school of social work, university of minnesota, st. paul, mn, usa",2961,44.9834421,-93.1812239,"United States"
"6072","school of public health, university of minnesota, minneapolis, mn, usa",2962,44.9721714,-93.2331609,"United States"
"6074","college of dentistry, new york university, new york, ny, usa",2963,40.7394962,-73.982669,"United States"
"6075","school of public health, rutgers university, piscataway, nj, usa",2964,40.5235161,-74.4708964,"United States"
"6076","family nurse practitioner, intermountain healthcare, salt lake city, ut",2965,40.761056,-111.864849,"United States"
"6077","college of nursing, brigham young university, provo, ut",2966,40.2473775,-111.6510826,"United States"
"6078","school of family life, brigham young university, provo, ut",2967,40.2473775,-111.6510826,"United States"
"6080","university medical center at texas tech university, lubbock, tx",2968,33.5891044,-101.8919265,"United States"
"6081","mckay school of education, brigham young university, provo, ut",2969,40.2471897,-111.6518659,"United States"
"6082","brigham and women's hospital, 75 francis street, boston, ma, 02115, usa",2970,42.3360139,-71.1069841,"United States"
"6084","standford hospital and clinics, standford, ca, usa",2971,37.4335357,-122.1753902,"United States"
"6086","richard montgomery high school, rockville, md, usa",2972,39.079373,-77.146657,"United States"
"6088","centre for maternal and newborn health, liverpool school of tropical medicine, liverpool, uk",2973,53.4086471,-2.969825,"United Kingdom"
"6090","massachusetts general hospital, boston, massachusetts",2974,42.3631763,-71.0688305,"United States"
"6092","sherbrooke university hospital center (chus), quebec university of trois-rivières (uqtr), trois-rivières, quebec, canada ephelma grenoble national polytechnique institute (inp), grenoble, france",2975,45.188529,5.724524,"France"
"6093","dr. coelho is visiting scholar, school of dentistry, university of north carolina at chapel hill",2976,35.9045551,-79.0537119,"United States"
"6094","dr. parker is a third-year resident, school of dentistry, university of north carolina at chapel hill",2977,35.9045551,-79.0537119,"United States"
"6095","and dr. tawil is graduate program director, school of dentistry, university of north carolina at chapel hill",2978,35.9045551,-79.0537119,"United States"
"6102","ottawa, ontario, canada",2979,45.4215296,-75.6971931,"Canada"
"6103","johns hopkins university school of medicine, 601n",2980,39.2992161,-76.5933799,"United States"
"6104","caroline st., jhoc 2114a, baltimore, md 21287, usa",2981,39.2969283,-76.5951344,"United States"
"6115","faculty of veterinary medicine,jordan university of science and technology,jordan",2982,32.4950392,35.9912257,"Jordan"
"6116","faculty of nursing,jordan university of science and technology,jordan",2983,32.4994684,35.9938342,"Jordan"
"6119","joaquim bosch-barrera, catalan institute of oncology doctor josep trueta university hospital, avinguda de franca s/n, 17007 girona, spain",2984,41.9934371,2.8080635,"Spain"
"6121","faculty of health sciences, university college of southeast, norway",2985,59.5684418,9.2797328,"Norway"
"6123","vestfold hospital trust, tønsberg, norway",2986,59.2723329,10.4179079,"Norway"
"6124","faculty of health, care and nursing, norwegian university of science and technology, norway",2987,63.419499,10.4020771,"Norway"
"6125","university of arizona college of medicine, tucson, ariz",2988,32.2400471,-110.9461316,"United States"
"6126","mayo clinic hospital, phoenix, ariz",2989,33.6582371,-111.9562201,"United States"
"6127","karolinska institutet, care sciences and society , huddinge , sweden",2990,59.2097726,18.052167,"Sweden"
"6128","university of north carolina at chapel hill school of medicine, campus box 7231, chapel hill, nc 27599, usa",2991,35.906058,-79.052199,"United States"
"6129","duke university medical center, dumc box 2644, durham, nc 27710, usa",2992,36.0038131,-78.9387241,"United States"
"6130","ann & robert h. lurie children's hospital of chicago, 225 e",2993,41.8962237,-87.6218321,"United States"
"6131","chicago ave, chicago, il 60611, usa",2994,41.8967646,-87.622349,"United States"
"6133","northwestern university feinberg school of medicine, center for community health, 750 n",2995,41.896148,-87.6171094,"United States"
"6134","lake shore dr. chicago, il 60611, usa",2996,41.9008774,-87.6222017,"United States"
