"","ShortAffil","id","lat","long","country"
"3132","and la jolla, ca",1422,NA,NA,NA
"3137","rollins school of public health, emory university, atlanta, ga",1423,33.7974199,-84.3234238,"United States"
"3138","graduate school of korea university, seoul, korea",1424,37.590799,127.0277773,"South Korea"
"3141","complejo hospitalario universitario de albacete. albacete. españa and escuela nacional de sanidad. instituto de salud carlos iii. madrid",1425,38.9854014,-1.8463039,"Spain"
"3142","escuela nacional de sanidad. instituto de salud carlos iii. madrid",1426,40.4747715,-3.6941042,"Spain"
"3145","departamento de medicina preventiva y salud pública. facultad de medicina. universidad autónoma de madrid/idipaz and ciberesp",1427,NA,NA,NA
"3147","university of southern california, 1540 alcazar st., chp 155, los angeles, ca, 90089, usa",1428,34.0630017,-118.2043898,"United States"
"3148","gold coast health and griffith university, southport, 4215, qld, australia",1429,-27.960131,153.378726,"Australia"
"3153","agile physical therapy, 3825 el camino real, palo alto, ca, 94306, usa",1430,37.4178227,-122.1312641,"United States"
"3155","shenzhen institutes of advanced technology, chinese academy of sciences, shenzhen 518055, china",1431,22.595692,113.990429,"China"
"3160","department of obstetrics and gynecology and",1432,44.9721714,-93.2331609,"United States"
"3161","school of health sciences, university of stirling (highland campus), centre for health science, old perth road, inverness, iv2 3jh, united kingdom",1433,57.4765057,-4.192062,"United Kingdom"
"3163","school of health sciences, university of stirling, stirling, fk9 4la, united kingdom",1434,56.1492131,-3.9267942,"United Kingdom"
"3166","glaucoma service, moorfields eye hospital, london, uk",1435,51.4262841,-0.1760506,"United Kingdom"
"3167","comprehensive community based rehabilitation in tanzania disability hospital, dar es salaam, tanzania",1436,-6.7683122,39.2713813,"Tanzania"
"3170","sydney hospital and sydney eye hospital, sydney, australia",1437,-33.8681622,151.2122224,"Australia"
"3171","institute of ophthalmology, university college london, london, uk",1438,51.527226,-0.091226,"United Kingdom"
"3172","deputy editor, jama",1439,NA,NA,NA
"3175","university of texas health science center at san antonio, 7703 floyd curl drive, mc 7737, san antonio, tx 78229, usa",1440,29.5074654,-98.5753521,"United States"
"3177","children's national health system,children's national heart institute,washington,district of columbia,united states of america",1441,38.9268055,-77.0146145,"United States"
"3178","university of nevada school of medicine, reno, nevada",1442,36.15928,-115.177507,"United States"
"3179","university medical center of southern nevada, las vegas, nevada",1443,36.1604551,-115.1677341,"United States"
"3186","center on research and evaluation, simmons school of education and human development, southern methodist university, dallas, tx",1444,32.8450438,-96.7821513,"United States"
"3187","texas obesity research center, university of houston, houston, tx",1445,29.7244152,-95.3470978,"United States"
"3189","usda/ars children's nutrition research center, baylor college of medicine, houston, tx",1446,29.70702,-95.4017929,"United States"
"3192","school of health, university of new england, armidale, new south wales, australia",1447,-30.4899535,151.6410199,"Australia"
"3194","faculty of health, federation university australia, ballarat, victoria, australia",1448,-37.626441,143.8910952,"Australia"
"3195","une business school, university of new england, armidale, new south wales, australia",1449,-30.4899535,151.6410199,"Australia"
"3196","amenzies health institute queensland, griffith university, gold coast bqimr berghofer medical research institute, brisbane city, queensland, australia",1450,-27.4697707,153.0251235,"Australia"
"3197","the university of texas md anderson cancer center, houston, texas",1451,29.7071962,-95.3966904,"United States"
"3202","the university of texas medical branch at galveston, galveston, texas",1452,29.3110199,-94.7777698,"United States"
"3203","school of allied health sciences, baylor college of medicine, houston, texas",1453,29.710529,-95.396241,"United States"
"3204","hepatology & nutrition, the university of texas md anderson cancer center, houston, texas",1454,36.1026522,-95.9260291,"United States"
"3206","postgraduate institute of medical education and research, chandigarh 160 032, india",1455,30.7608306,76.7758452,"India"
"3208","government medical college, sector 32, chandigarh 160 032, india",1456,30.7089156,76.7804175,"India"
"3209","oxford health nhs foundation trust, aylesbury, buckinghamshire, uk",1457,51.8208084,-0.8031768,"United Kingdom"
"3210","dr. furgeson is clinical assistant professor, school of dentistry, university of michigan",1458,42.2787462,-83.7363241,"United States"
"3211","prof. kinney is director, dental hygiene program and clinical associate professor, school of dentistry, university of michigan",1459,42.2787462,-83.7363241,"United States"
"3212","prof. gwozdek is director, dental hygiene graduate and degree completion programs, and clinical assistant professor, school of dentistry, university of michigan",1460,42.2787462,-83.7363241,"United States"
"3213","prof. wilder is professor, director of faculty development, and director of graduate dental hygiene education, school of dentistry, university of north carolina at chapel hill",1461,35.9045551,-79.0537119,"United States"
"3214","and dr. inglehart is professor, school of dentistry and adjunct professor, college of literature, science, and arts, university of michigan",1462,42.2761921,-83.7413068,"United States"
"3235","school of medicine, the university of nottingham , nottingham , uk",1463,52.938636,-1.1951582,"United Kingdom"
"3236","università cattolica del sacro cuore, milan, italy",1464,45.4621325,9.1771785,"Italy"
"3238","applied technology for neuro-psychology lab. istituto auxologico italiano, milan, italy",1465,45.4642035,9.189982,"Italy"
"3245","psychiatric registrar, mental health services of older people, auckland district health board, auckland, and",1466,-36.8944687,174.7805867,"New Zealand"
"3246","clinical fellow, centre of health system innovation and improvement (ko awatea), manukau district health board, auckland, new zealand",1467,-36.963123,174.842932,"New Zealand"
"3247","senior lecturer, university of auckland, auckland, and",1468,-36.8523378,174.7691073,"New Zealand"
"3248","consultant psychiatrist, north shore hospital, auckland, new zealand",1469,-36.7811728,174.757391,"New Zealand"
"3249","head, south auckland clinical school, university of auckland, new zealand",1470,-36.8523378,174.7691073,"New Zealand"
"3250","school of psychology, massey university, auckland, new zealand",1471,-36.7256338,174.6944135,"New Zealand"
"3252","consultant psychiatrist, auckland city hospital, auckland, new zealand",1472,-36.8604597,174.7691264,"New Zealand"
"3253","santa catarina federal university, cnpq, undergraduate nursing program, campus health sciences center, trindade district, florianópolis cep: 88040-900, santa catarina, brazil",1473,-27.2423392,-50.2188556,"Brazil"
"3260","university of chicago, section of dermatology, chicago, illinois",1474,41.7886079,-87.5987133,"United States"
"3261","the dermatology institute-naperville, dupage medical group, naperville, illinois",1475,41.8084986,-88.2012078,"United States"
"3263","state key laboratory of quality research in chinese medicine, institute of chinese medical sciences, university of macau, room 2057, building n22, avenida da universidade, taipa, macau, china",1476,22.1596848,113.563922,"Macau"
"3268","mimi jenko, dnp, rn, chpn, pmhcns-bc, winter haven, florida",1477,27.943362,-81.6913129,"United States"
"3269","her clinical interest is palliative care, with a specialty in bereavement",1478,NA,NA,NA
"3270","judith a. adams, phd, msn, rn, fnp, is visiting assistant professor at the school of nursing, university of north carolina at greensboro",1479,36.0689296,-79.8101975,"United States"
"3271","dr adams worked as a nurse practitioner in hospice and palliative care",1480,35.1449355,-90.0317692,"United States"
"3272","her research focuses on palliative care and nursing communication in the intensive care unit. constance m. johnson, phd, ms, rn, faan, is an associate professor and a health informaticist with interdisciplinary training in nursing and health informatics and is lead faculty for the informatics specialty at the duke university school of nursing",1481,NA,NA,NA
"3273","dr johnson's research interests include human-computer interaction and how presentation of information impacts health-related decisions in the areas of cancer prevention and diabetes. julie a. thompson, phd, is a consulting associate, duke university school of nursing",1482,36.0060828,-78.9352119,"United States"
"3274","she is a content expert for statistics. donald e. bailey jr, phd, rn, faan, is an associate professor in the duke university school of nursing, senior fellow in the duke center for the study of aging and human development, and claire m",1483,28.43028,-81.478994,"United States"
"3275","fagin fellow. his research interests include aging and chronic illness, men's health, and psychooncology",1484,25.7126931,-80.2810435,"United States"
"3276","provide, inc",1485,NA,NA,NA
"3277"," 47 thorndike street, cambridge, ma 02141",1486,42.3698813,-71.0794704,"United States"
"3279"," cambridge, ma 02141",1487,NA,NA,NA
"3282","santa barbara, ca 93101",1488,34.420334,-119.7107494,"United States"
"3284","american board of ophthalmology, bala cynwyd, pennsylvania",1489,40.012332,-75.213778,"United States"
"3285","casey eye institute, oregon health and sciences university, portland, oregon",1490,45.4989469,-122.6713068,"United States"
"3287","mid-atlantic retina, philadelphia, pennsylvania",1491,39.9479211,-75.1549358,"United States"
"3289","dean mcgee eye institute, oklahoma city, oklahoma",1492,35.4799607,-97.5015815,"United States"
"3290","university of oklahoma college of medicine, oklahoma city, oklahoma",1493,35.4798986,-97.498395,"United States"
"3292","medical college of wisconsin, milwaukie, wisconsin",1494,43.0435866,-88.0211208,"United States"
"3293","temple university school of medicine, philadelphia, pa",1495,40.0068696,-75.1522336,"United States"
"3294","university laboratory animal resources, temple university school of medicine, philadelphia, pa",1496,40.0068696,-75.1522336,"United States"
"3297","a grace abbott school of social work, university of nebraska-omaha , omaha , nebraska , usa",1497,41.2582497,-96.0107049,"United States"
"3298","university of south alabama, mobile, al, usa",1498,30.6959406,-88.184236,"United States"
"3300","university of alabama-birmingham, birmingham, al, usa",1499,33.5021227,-86.8064447,"United States"
"3306","loyola university medical center, maywood, il, usa",1500,41.8605645,-87.8346346,"United States"
"3307","university ""g. d'annunzio"", chieti-pescara, via dei vestini 5, 66100, chieti, italy",1501,42.3640936,14.1504221,"Italy"
"3308","center of excellence on aging, ""g. d'annunzio"" university foundation, chieti, italy",1502,42.347886,14.1635845,"Italy"
"3311","pediatric unit, prevention and public health, asl fg, foggia, italy",1503,41.4556173,15.5512146,"Italy"
"3316","dr. carnes is director, center for women's health research, professor, psychiatry, and industrial & systems engineering, university of wisconsin-madison, madison, wisconsin, and part-time physician, william s",1504,36.1134646,-96.1180924,"United States"
"3317","middleton memorial veterans hospital, madison, wisconsin",1505,43.074461,-89.431099,"United States"
"3318","dr. devine is professor and chair, university of wisconsin-madison, madison, wisconsin",1506,43.0730517,-89.4012302,"United States"
"3319","ms. baier manwell is a research administrator, university of wisconsin-madison, madison, wisconsin, and national training coordinator for women's health services, veterans health administration central office, washington, dc",1507,38.9008077,-77.0350572,"United States"
"3320","dr. byars-winston is associate professor, university of wisconsin-madison, madison, wisconsin",1508,43.0763489,-89.4313395,"United States"
"3321","dr. fine is a researcher, women in science and engineering leadership institute, university of wisconsin-madison, madison, wisconsin",1509,43.0730517,-89.4012302,"United States"
"3322","dr. ford is professor, university of wisconsin-madison, madison, wisconsin",1510,43.076349,-89.43134,"United States"
"3323","mr. forscher is a graduate student, university of wisconsin-madison, madison, wisconsin",1511,43.0730517,-89.4012302,"United States"
"3324","dr. isaac is assistant professor, mercer university, atlanta, georgia",1512,33.87382,-84.263094,"United States"
"3325","dr. kaatz is assistant scientist, center for women's health research, university of wisconsin-madison, madison, wisconsin",1513,43.076592,-89.4124875,"United States"
"3326","dr. magua is a postdoctoral fellow, center for women's health research, university of wisconsin-madison, madison, wisconsin",1514,43.0730517,-89.4012302,"United States"
"3327","dr. palta is professor, university of wisconsin-madison, madison, wisconsin",1515,43.076592,-89.4124875,"United States"
"3328","dr. sheridan is executive and research director, women in science and engineering leadership institute, university of wisconsin-madison, madison, wisconsin",1516,43.0730517,-89.4012302,"United States"
"3329","office of academic advancement, nell hodgson woodruff school of nursing, emory university, atlanta, ga",1517,33.7981025,-84.3236588,"United States"
"3336","friedrich-alexander-university erlangen-nürnberg, universitaetsstrasse 19, 91054, erlangen, germany",1518,49.5978804,11.0045507,"Germany"
"3341","hospital meissenberg, psychiatric and psychotherapeutical specialist hospital for women, zug, switzerland",1519,47.1661672,8.5154946,"Switzerland"
"3344","americans for medical progress, alexandria, va",1520,38.8958562,-77.0097865,"United States"
"3345","university of new brunswick, saint john, canada",1521,45.305862,-66.084523,"Canada"
"3347","tim blake is an associate professor of nursing at ohio university - zanesville",1522,39.9607141,-82.0304975,"United States"
"3349","a program evaluation and research unit, university of pittsburgh school of pharmacy , pittsburgh , pennsylvania , usa",1523,40.4426619,-79.9628895,"United States"
"3350","mercer university school of medicine and navicent health , macon , georgia , usa",1524,32.827916,-83.64811,"United States"
"3353","baylor college of medicine , houston , texas , usa",1525,29.710529,-95.396241,"United States"
"3356","d rti international , durham , north carolina , usa",1526,35.9059931,-78.8637741,"United States"
"3357","wayne state university, 320 east canfield, detroit, mi, 48201, usa",1527,42.3591388,-83.0665462,"United States"
"3358","wayne state university, 4201 st. antoine, university health center 2e, detroit, mi, 48201, usa",1528,42.3534569,-83.0544168,"United States"
"3359","wayne state university, detroit, mi, 48201, usa",1529,42.3591388,-83.0665462,"United States"
"3366","ucl institute of child health, london, uk",1530,51.523309,-0.120066,"United Kingdom"
"3367","clinical and molecular genetics, ucl institute of child health and great ormond street hospital for children nhs foundation trust, level 5, barclay house 37 queen square, london, wc1n 3bh, uk",1531,51.5218791,-0.1210421,"United Kingdom"
"3368","fetal medicine unit, university college london hospitals nhs foundation trust, london, uk",1532,51.5250834,-0.1363551,"United Kingdom"
"3370","johns hopkins university school of medicine , baltimore, maryland",1533,39.2992161,-76.5933799,"United States"
"3373","leadership and career development coach , falls church, virginia",1534,38.882334,-77.1710914,"United States"
"3375","oncology, and institute for cellular engineering, johns hopkins university school of medicine , baltimore, maryland",1535,39.2992161,-76.5933799,"United States"
"3376","faculty of veterinary and agricultural sciences, the university of melbourne, werribee, vic 3030, australia",1536,-37.9,144.664,"Australia"
"3378","arc-sri science of learning research centre, melbourne centre for the study of higher education, the university of melbourne, vic 3010, australia",1537,-37.7963689,144.9611738,"Australia"
"3379","new york university school of medicine, new york, ny, united states of america",1538,40.7420088,-73.9742282,"United States"
"3380","robert f. wagner graduate school of public service, new york, ny, united states of america",1539,40.7246454,-73.9953925,"United States"
"3381","new york university steinhardt school of culture, education and human development, new york, ny, united states of america",1540,40.7296492,-73.995999,"United States"
"3384","maxwell school, syracuse university, syracuse, ny, united states of america",1541,43.0379769,-76.1355729,"United States"
"3385","utrecht and nijmegen, the netherlands",1542,52.090486,5.1116656,"Netherlands"
"3386","southampton, united kingdom",1543,50.9097004,-1.4043509,"United Kingdom"
"3395","norko: yale university school of medicine and connecticut department of mental health and addiction services",1544,41.7641143,-72.6896317,"United States"
"3396","buchanan: yale university school of medicine and st. andrews, northampton uk",1545,41.303229,-72.933826,"United States"
"3397","menzies school of health research, darwin, nt, australia",1546,-12.3716034,130.8692834,"Australia"
"3398","cancer council victoria, melbourne, vic, australia",1547,-37.852331,144.9820522,"Australia"
"3399","aboriginal health & medical research council, sydney, nsw, australia",1548,43.2484261,-79.8430485,"Canada"
"3400","aboriginal medical services alliance northern territory, darwin, nt, australia",1549,-12.4652848,130.8410673,"Australia"
"3401","university of melbourne, melbourne, vic, australia",1550,-37.7963689,144.9611738,"Australia"
"3404","municipal health service zeeland, goes, the netherlands",1551,51.5046455,3.8911304,"Netherlands"
"3405","julius center for health sciences and primary care, university medical center utrecht, utrecht, the netherlands",1552,52.0864382,5.1775203,"Netherlands"
"3407","faculty of social and behavioural sciences, university of amsterdam, amsterdam, the netherlands",1553,52.3558182,4.9557263,"Netherlands"
"3409","women's and infants' services and pediatrics for banner health in northern, co",1554,40.5212354,-105.0087875,"United States"
"3410","king saud bin abdulaziz university for health sciences, riyadh saudi arabia",1555,24.7545024,46.8533173,"Saudi Arabia"
"3411","riyadh, saudi arabia",1556,24.7135517,46.6752957,"Saudi Arabia"
"3412","gcc center for infection control, ministry of national guard-health affairs, riyadh, saudi arabia",1557,24.7480292,46.8568513,"Saudi Arabia"
"3413","ministry of health, riyadh, saudi arabia",1558,24.6572002,46.7127829,"Saudi Arabia"
"3414","ministry of health, kuwait, kuwait",1559,29.3708779,47.9916213,"Kuwait"
"3415","ministry of health, muscat, oman",1560,23.5981369,58.4197891,"Oman"
"3416","ministry of public health, doha, qatar",1561,25.296942,51.508852,"Qatar"
"3417","ministry of health, almanamah, bahrain",1562,26.2139943,50.6094217,"Bahrain"
"3418","ministry of health, united arab emirates",1563,25.3322782,55.3906792,"United Arab Emirates"
"3419","world health organization, geneva, switzerland",1564,46.2327276,6.1343571,"Switzerland"
"3420","infection control programme and world health organization collaborating centre on patient safety, university of geneva hospitals, geneva, switzerland",1565,46.2327276,6.1343571,"Switzerland"
"3422","university of leipzig, germany",1566,51.3385738,12.3784615,"Germany"
"3423","university of leipzig, endodontology and periodontology, germany",1567,48.63971,9.012,"Germany"
"3425","deborah l. dillon is assistant professor, university of virginia school of nursing, 225 jeannette lancaster way, mcleod hall, rm 4007, charlottesville, va (). mary a. dolansky is associate professor, frances payne bolton school of nursing, case western reserve university, cleveland, ohio",1568,41.5043413,-81.6083838,"United States"
"3426","kathy casey is manager, clinical education, lutheran medical center, wheat ridge, colorado",1569,39.7679487,-105.089837,"United States"
"3427","carol kelley is assistant professor, frances payne bolton school of nursing, case western reserve university, cleveland, ohio",1570,41.5043413,-81.6083838,"United States"
"3428","hofstra north shore-lij school of medicine/steven & alexandra cohen children's medical center, icahn school of medicine at mount sinai, new york, new york, usa",1571,40.7175339,-73.5980263,"United States"
"3429","the george washington university milken institute school of public health and health services, washington, dc, 20052, usa",1572,38.9020965,-77.051046,"United States"
"3431","institut pasteur, national reference centre for rabies, paris, france",1573,48.8403734,2.3112488,"France"
"3433","institut pasteur, dakar, senegal",1574,14.656177,-17.4351552,"Senegal"
"3434","grand saconnex, switzerland",1575,46.2331904,6.1231633,"Switzerland"
"3437","health sciences etraining (hset) foundation, 155 chemin des boveresses, 1066 epalinges, switzerland",1576,46.5421881,6.66317,"Switzerland"
"3443","undergraduate medical school, university of glasgow, college of mlvs, glasgow, uk",1577,55.8718983,-4.2893714,"United Kingdom"
"3447","dokuz eylül university faculty of medicine, izmir, turkey",1578,38.4306911,27.1369201,"Turkey"
"3448","primary care clinical sciences, university of birmingham, b15 2tt, birmingham, edgbaston, uk",1579,52.4608009,-1.914995,"United Kingdom"
"3449","public health, epidemiology and biostatistics, university of birmingham, b15 2tt, birmingham, edgbaston, uk",1580,52.4608009,-1.914995,"United Kingdom"
"3451","bristol randomised trials collaboration, school of social and community medicine, university of bristol, canynge hall, 39 whatley road, bs8 2ps, bristol, uk",1581,51.4647936,-2.6119457,"United Kingdom"
"3452","uk health forum, fleetbank house, 2-6 salisbury square, ec4y 8jx, london, uk",1582,51.5136893,-0.1067849,"United Kingdom"
"3453","university of oxford, new radcliffe house, radcliffe observatory quarter, woodstock road, ox2 6gg, oxford, uk",1583,51.7608394,-1.2638116,"United Kingdom"
"3455","a laboratory of human performance, faculty of physical activity and sport , university of the basque country , vitoria , spain",1584,42.8398835,-2.669699,"Spain"
"3456","b faculty of health sciences , universidad isabel i , www.u",1585,42.3412374,-3.7100273,"Spain"
"3457","ui1.es, burgos , spain",1586,42.3412374,-3.7100273,"Spain"
"3458","c centro de perfeccionamiento técnico de fadura, sports authority , basque government , getxo , spain",1587,43.3280845,-3.0133862,"Spain"
"3461","d faculty of kinesiology, sports diagnostic center , university of zagreb , zagreb , croatia",1588,45.8105703,15.9698015,"Croatia"
"3462","e exercise physiology lab , center for health, exercise and sport sciences , belgrade , serbia",1589,44.786568,20.4489216,"Serbia"
"3463","exercise and health , university of trás-os- montes and alto douro , vila real , portugal",1590,41.2873865,-7.7389859,"Portugal"
"3464","g creativelab, research center for sport sciences, health and human development , university of trás-os-montes e alto douro at vila real , vila real , portugal",1591,41.2873865,-7.7389859,"Portugal"
"3465","h regional sports medicine unit of asturias, university of oviedo , oviedo , spain",1592,43.3617179,-5.8462773,"Spain"
"3466","w.j. eppich is associate professor of pediatrics and medical education, northwestern university feinberg school of medicine, chicago, illinois",1593,41.896148,-87.6171094,"United States"
"3467","e.a. hunt is associate professor of anesthesiology and critical care medicine and of health science informatics and pediatrics, johns hopkins university school of medicine, baltimore, maryland",1594,39.2992161,-76.5933799,"United States"
"3468","j.m. duval-arnould is instructor of anesthesiology and critical care medicine and of health sciences informatics, johns hopkins university school of medicine, baltimore, maryland",1595,39.2992161,-76.5933799,"United States"
"3469","v.j. siddall is simulation clinical educator and research assistant, stritch school of medicine, loyola university, maywood, illinois",1596,41.8605645,-87.8346346,"United States"
"3470","a. cheng is associate professor of pediatrics, cumming school of medicine, university of calgary, calgary, alberta, canada",1597,51.0486151,-114.0708459,"Canada"
"3471","a school of health and applied human sciences , university of north carolina wilmington , wilmington , north carolina , usa",1598,34.2239869,-77.8701325,"United States"
"3472","the university of alabama , tuscaloosa , alabama , usa",1599,33.2140233,-87.5391418,"United States"
"3477","beaumont cancer institute, oakland university william beaumont school of medicine, royal oak, michigan",1600,42.6744905,-83.2152964,"United States"
"3478","cancer institute, tehran university of medical sciences, tehran, iran",1601,35.7058552,51.3941057,"Iran"
"3479","school of continuing and professional studies, university of virginia, charlottesville, virginia",1602,38.0335529,-78.5079772,"United States"
"3480","college of public health, university of oklahoma health sciences center, oklahoma city, oklahoma",1603,35.4797128,-97.5005354,"United States"
"3482","national board of medical examiners, 3750 market street, philadelphia, pa, 19104, usa",1604,39.95635,-75.197829,"United States"
"3483","university hospital of north norway, tromsø, norway",1605,69.6829614,18.9824887,"Norway"
"3487","texas children's hospital, baylor college of medicine, houston, tex",1606,29.7078171,-95.401626,"United States"
"3489","a medical school, oxford university , oxford , uk",1607,51.7548164,-1.2543668,"United Kingdom"
